genomic instability file paths:,
tumor fraction file paths:,
patient treatment progression:,
central depth file path:,
time point:,
genomic instability and tumor fraction data processing:, False,
central depth data processing:, False,
combine data tables:, False,
genomic instability and tumor fraction scatter plots:, False,
genomic instability and tumor fraction line plots:, False,
central depth pca plot:, False,
central depth heatmap:, False,
save heatmap data frames:, False,
central depth differential activity:, False,
central depth and tumor fraction density plot:, False,
central depth and tumor fraction regression:, False,
central depth and tumor fraction spearman rho plot:, False,
cox forest plots of sig tfbs against clinical data:, False,